name,ingredients,diet,prep_time,cook_time,flavor_profile,course,state,region,recipe
lilva kachori,"green garlic chutney, fresh green peas, ginger, lemon juice, plain flour",vegetarian,30,6,spicy,snack,Gujarat,West,HM1TjUfjS64
mag dhokli,"moong beans, jaggery, red chillies, oil, salt",vegetarian,-1,-1,spicy,snack,Gujarat,West,HiFTTiIh8h8
khichu,"rice flour, sesame seeds, baking soda, peanut oil",vegetarian,5,10,spicy,snack,Gujarat,West,Tmdh0Q3KZ3k
thepla,"chickpea flour, methi leaves, jowar flour, wheat flour",vegetarian,15,30,spicy,snack,Gujarat,West,58_t_zaygFg
farsi puri,"semolina, clarified butter, oil, white flour, black pepper",vegetarian,-1,-1,other,snack,Gujarat,West,r8StpJhdPEo
khaman,"yogurt, fresh coconut, sesame seeds, semolina, gram flour",vegetarian,10,20,spicy,snack,Gujarat,West,20smULMN0rQ
turiya patra vatana sabji,"ridge gourd, baking soda, sugar, grated coconut, peas",vegetarian,35,40,spicy,main course,Gujarat,West,n45Y-xXKv5A
churma ladoo,"whole wheat flour, khus khus, sesame seeds, dry coconut, gur",vegetarian,12,40,sweet,dessert,Rajasthan,West,-aWNGbAG8Hc
cheera doi,"rice, mango, curd",vegetarian,-1,-1,sweet,dessert,West Bengal,East,UrG3fUBpEKI
gheela pitha,"sticky rice, rice flour, jaggery, orange rind",vegetarian,10,30,sweet,dessert,Assam,North East,i4QGIMdSzig
khar,"raw papaya, panch phoran masala, nigella seeds, mustard oil, fennel seeds",vegetarian,10,20,other,main course,Assam,North East,tzdiv8Pst50
kumol sawul,"rice, eggs, carrot, beetroot",non-vegetarian,-1,-1,spicy,main course,Assam,North East,8uELAyp7zmg
luchi,"maida, vegetable oil",vegetarian,20,30,other,main course,West Bengal,East,pbiI4lzJ31c
alu pitika,"potatoes, mustard oil, fish, green chillies",non-vegetarian,5,20,spicy,main course,Assam,North East,pmpgrd18chU
masor tenga,"ridge gourd, fish, lemon, tomatoes, mustard oil",non-vegetarian,15,25,spicy,main course,Assam,North East,cVBj687R-3I
bengena pitika,"brinjal, onions, salt, sesame seeds, coriander",vegetarian,-1,-1,other,main course,Assam,North East,LwST-yO5GnI
bilahi maas,"potatoes, garam masala, tomatoes, mustard oil, bay leaf",non-vegetarian,10,20,other,main course,Assam,North East,34eZxHHfXaE
black rice,"forbidden black rice, chicken, olive oil, slivered almonds, garlic powder",non-vegetarian,-1,-1,other,main course,Manipur,North East,IQI6D2ENKNU
bora sawul,"biryani masala, mixed vegetables, yellow moong daal, whole red, mustard seeds",vegetarian,-1,-1,spicy,main course,Assam,North East,dL1-tY8uKOE
brown rice,"brown rice, soy sauce, olive oil",vegetarian,15,25,other,main course,All State,All Region,OEB4104Ng4U
chingri malai curry,"coconut milk, lobster, fresh green chilli, ginger, red onion",non-vegetarian,10,40,spicy,main course,West Bengal,East,850UwVgrC5c
goja,"baking soda, clarified butter, oil, all purpose flour",vegetarian,20,60,sweet,dessert,West Bengal,East,0kq_sJTf8tE
hando guri,"jaggery, raisins",vegetarian,-1,-1,sweet,dessert,Assam,North East,9a4W_kg5poY
haq maas,"lamb, garam masala powder, curd, turmeric, bay leaf",non-vegetarian,20,40,spicy,main course,Assam,North East,PDTQjwDy2Ms
chingri bhape,"coconut, prawns, curd, mustard seed, green chili",non-vegetarian,15,30,other,main course,West Bengal,East,W4POHmKypkc
kabiraji,"fish fillet, besan, lemon, mint, ginger",non-vegetarian,-1,-1,spicy,main course,West Bengal,East,NzH3EzqOCVE
khorisa,"fermented bamboo shoot, potato, ginger, green, mustard oil",vegetarian,-1,-1,spicy,main course,Assam,North East,ThRmg5FK0N4
koldil chicken,"banana flower, chicken, green chili, mustard oil, lemon juice",non-vegetarian,-1,-1,spicy,main course,Assam,North East,w2HmdNNO7pA
konir dom,"aloo, tomatoes, mustard oil, bay leaf, cinnamon stick",non-vegetarian,-1,-1,spicy,main course,Assam,North East,15iaY7VMQhc
koldil duck,"rice flour, mutton, banana, gram flour, olive oil, baking powder",non-vegetarian,-1,-1,spicy,main course,Assam,North East,1o-3zvdW3T8
masor koni,"fish roe, pumpkin flowers, mustard oil, turmeric, tomato",non-vegetarian,-1,-1,spicy,main course,Assam,North East,lWsQS0RLkAg
mishti chholar dal,"chana dal, fresh coconut, ginger, cinnamon, raisins",vegetarian,10,30,sweet,main course,West Bengal,East,MtcAg-5SeT8
pakhala,"curd, cooked rice, curry leaves, dry chilli",vegetarian,-1,-1,other,main course,Odisha,East,HClZ1xoShmM
pani pitha,"tea leaves, white sesame seeds, dry coconut, soaked rice",vegetarian,10,20,other,main course,Assam,North East,ayT_zpWwdNA
payokh,"basmati rice, rose water, sugar, clarified butter, cardamom pods",vegetarian,-1,-1,sweet,dessert,Assam,North East,PKZ5jlk2SxM
prawn malai curry,"coconut milk, prawns, garlic, turmeric, sugar",non-vegetarian,15,50,spicy,main course,West Bengal,East,850UwVgrC5c
red rice,"red pepper, red onion, butter, watercress, olive oil",vegetarian,-1,-1,other,main course,All State,All Region,jyREjg2ONUg
shukto,"green beans, bitter gourd, ridge gourd, banana, brinjal",vegetarian,10,20,spicy,main course,West Bengal,East,cPpqi7obNXI
til pitha,"glutinous rice, black sesame seeds, gur",vegetarian,5,30,sweet,dessert,Assam,North East,r0KCvJfLSCw
bebinca,"coconut milk, egg yolks, clarified butter, all purpose flour",vegetarian,20,60,sweet,dessert,Goa,West,F9CjgCGRkBk
shufta,"cottage cheese, dry dates, dried rose petals, pistachio, badam",vegetarian,-1,-1,sweet,dessert,Jammu & Kashmir,North,Y5mx1H_034k
mawa bati,"milk powder, dry fruits, arrowroot powder, all purpose flour",vegetarian,20,45,sweet,dessert,Madhya Pradesh,Central,7R9Ul8BKpok
pinaca,"brown rice, fennel seeds, grated coconut, black pepper, ginger powder",vegetarian,-1,-1,sweet,dessert,Goa,West,rLsj9gDDizs
